{
  "name": "agile-pm",
  "version": "1.0.0",
  "author": "William Newton",
  "description": "Agile and product management: discovery, delivery, iteration, hypothesis testing, and stakeholder workflows",
  "tags": [
    "agile",
    "product-management",
    "discovery",
    "delivery",
    "iteration"
  ],
  "dependencies": [],
  "resources": {
    "skills": [
      "agile-pm/define-hypothesis",
      "agile-pm/define-jtbd-canvas",
      "agile-pm/define-opportunity-tree",
      "agile-pm/define-problem-statement",
      "agile-pm/deliver-launch-checklist",
      "agile-pm/deliver-prd",
      "agile-pm/deliver-user-stories",
      "agile-pm/discover-competitive-analysis",
      "agile-pm/discover-interview-synthesis",
      "agile-pm/discover-stakeholder-summary",
      "agile-pm/iterate-refinement-notes",
      "agile-pm/iterate-retrospective"
    ],
    "agents": [
      "business/business-analyst.md",
      "business/business-council.md",
      "business/quant-analyst.md",
      "business/startup-analyst.md"
    ],
    "commands": [
      "business/business-case.md",
      "business/business-panel.md",
      "business/cost-optimize.md",
      "business/financial-projections.md",
      "business/market-opportunity.md"
    ]
  }
}
