{
  "$schema": "./schema.json",
  "name": "tools",
  "version": "1.0.0",
  "description": "CLI tools, shell scripting, MCP integration, API design, and prompt engineering utilities",
  "author": "William Newton",
  "license": "MIT",
  "tags": [
    "cli",
    "shell",
    "bash",
    "mcp",
    "api",
    "prompts",
    "automation"
  ],
  "dependencies": [
    "core"
  ],
  "resources": {
    "skills": [
      "tools/agent-browser",
      "tools/api-design-principles",
      "tools/aws-mcp-setup",
      "tools/bash-script-generator",
      "tools/bash-script-validator",
      "tools/cli-developer",
      "tools/devcontainer-setup",
      "tools/docx-word-documents",
      "tools/excalidraw-diagram-generator",
      "tools/gh-cli-patterns",
      "tools/graphql-patterns",
      "tools/markitdown-converter",
      "tools/mcp-integration",
      "tools/mermaid-diagrams",
      "tools/obsidian",
      "tools/openapi-spec-generation",
      "tools/pdf-manipulation",
      "tools/playwright",
      "tools/pptx-presentations",
      "tools/rclone",
      "tools/regex-debugger",
      "tools/tmux-interactive-runner",
      "tools/token-reduction-optimizer",
      "tools/websocket-patterns",
      "tools/xlsx-spreadsheets",
      "tools/php-pro"
    ],
    "agents": [
      "ai-ml/prompt-engineer.md",
      "analysis/comment-analyzer.md",
      "analysis/conversation-analyzer.md",
      "analysis/data-flow-analyzer.md",
      "analysis/function-analyzer.md",
      "analysis/git-history-analyzer.md",
      "analysis/pattern-analyzer.md",
      "analysis/spec-flow-analyzer.md",
      "analysis/type-design-analyzer.md",
      "documentation/api-documenter.md",
      "languages/language-developer.md",
      "research/fact-checker.md",
      "analysis/repo-analyzer.md",
      "research/researcher.md",
      "research/source-researcher.md",
      "specialized/legacy-modernizer.md",
      "specialized/poc-builder.md",
      "specialized/pr-comment-resolver.md",
      "security/reverse-engineer.md",
      "specialized/terminal-engineer.md",
      "testing/api-tester.md"
    ],
    "commands": [
      "ai/prompt-optimize.md",
      "ai/run-prompt.md",
      "analysis/analyze.md",
      "analysis/entry-points.md",
      "analysis/error-analysis.md",
      "analysis/reflect.md",
      "analysis/report-bug.md",
      "analysis/reproduce-bug.md",
      "analysis/select-tool.md",
      "analysis/triage.md",
      "languages/ml-pipeline.md",
      "meta/create-prompt.md",
      "meta/hookify.md",
      "research/burp-search.md",
      "research/competitive.md",
      "research/deep-dive.md",
      "research/feasibility.md",
      "research/history.md",
      "research/landscape.md",
      "research/open-source.md",
      "research/options.md",
      "research/search.md",
      "research/technical.md",
      "setup/config-validate.md",
      "setup/configure.md",
      "setup/doctor.md",
      "setup/modes.md",
      "setup/onboard.md",
      "setup/settings.md",
      "setup/setup-pm.md",
      "setup/setup.md",
      "setup/template.md",
      "testing/api-mock.md"
    ]
  }
}
