{
  "$schema": "./schema.json",
  "name": "cpp",
  "version": "1.0.0",
  "description": "C++ development: modern C++ patterns, coding standards, and testing practices",
  "author": "William Newton",
  "license": "MIT",
  "tags": [
    "cpp",
    "c++",
    "systems",
    "performance"
  ],
  "dependencies": [
    "core"
  ],
  "resources": {
    "skills": [
      "cpp/cpp-pro",
      "cpp/cpp-testing",
      "cpp/embedded-systems"
    ],
    "agents": [],
    "commands": []
  }
}
