{
  "name": "workflow",
  "version": "1.0.0",
  "author": "William Newton",
  "description": "Development workflows: planning, git operations, decision records, continuous improvement (Kaizen), mental models, and Conductor project management",
  "tags": [
    "workflow",
    "planning",
    "kaizen",
    "git",
    "conductor"
  ],
  "dependencies": [
    "core"
  ],
  "resources": {
    "skills": [
      "workflow/conductor",
      "workflow/context-handoff",
      "workflow/resolve-pr-parallel",
      "workflow/create-plans",
      "workflow/deliver-edge-cases",
      "workflow/develop-adr",
      "workflow/develop-spike-summary",
      "workflow/executing-plans",
      "workflow/finishing-a-development-branch",
      "workflow/git-analyze-issue",
      "workflow/git-create-pr",
      "workflow/git-worktrees",
      "workflow/kaizen",
      "workflow/mental-models"
    ],
    "agents": [
      "planning/context-manager.md",
      "planning/fix-planner.md",
      "planning/pm-agent.md",
      "planning/prd-interviewer.md",
      "planning/repo-index.md",
      "planning/requirements-analyst.md"
    ],
    "commands": [
      "consider/10-10-10.md",
      "consider/5-whys.md",
      "consider/eisenhower-matrix.md",
      "consider/first-principles.md",
      "consider/inversion.md",
      "consider/occams-razor.md",
      "consider/one-thing.md",
      "consider/opportunity-cost.md",
      "consider/pareto.md",
      "consider/second-order.md",
      "consider/swot.md",
      "consider/via-negativa.md",
      "git/clean_gone.md",
      "git/diff-review.md",
      "git/git-workflow.md",
      "git/git.md",
      "git/pr-enhance.md",
      "git/revert.md",
      "git/review-pr.md",
      "planning/deepen-plan.md",
      "planning/estimate.md",
      "planning/kickoff.md",
      "planning/plan.md",
      "planning/pm.md",
      "planning/pm2-init.md",
      "planning/prd.md",
      "planning/projects.md",
      "planning/run-plan.md",
      "planning/task.md",
      "planning/team.md",
      "session/add-to-todos.md",
      "session/load.md",
      "session/save.md",
      "session/session-handoff.md",
      "session/sessions.md",
      "workflow/ask-me-questions.md",
      "workflow/escape.md",
      "workflow/eval.md",
      "workflow/improve.md",
      "workflow/index-repo.md",
      "workflow/list.md",
      "workflow/migrate.md",
      "workflow/multi-execute.md",
      "workflow/multi-workflow.md",
      "workflow/orchestrate.md",
      "workflow/promote.md",
      "workflow/spawn.md",
      "workflow/sync.md",
      "workflow/update-codemaps.md",
      "workflow/variants.md",
      "workflow/workflow.md"
    ]
  }
}
