{
  "$schema": "./schema.json",
  "name": "core",
  "version": "1.0.0",
  "description": "Essential development fundamentals: coding standards, testing, git workflow, debugging, and code review",
  "author": "William Newton",
  "license": "MIT",
  "tags": [
    "essential",
    "workflow",
    "standards",
    "testing",
    "git"
  ],
  "dependencies": [],
  "resources": {
    "rules": [
      "common/coding-style.md",
      "common/testing.md",
      "common/git-workflow.md",
      "common/development-workflow.md",
      "common/security.md",
      "common/patterns.md",
      "common/performance.md",
      "common/debugging.md",
      "common/hooks.md",
      "common/agents.md",
      "common/coding-standards.md",
      "common/clarification.md",
      "common/verification.md",
      "common/confidence.md",
      "common/context.md",
      "common/writing.md"
    ],
    "workflows": [
      "development/TDD.md",
      "development/SEARCH-FIRST.md",
      "development/COMMIT.md",
      "quality/VERIFICATION.md",
      "quality/DO-AND-JUDGE.md",
      "quality/CRITIQUE.md"
    ],
    "skills": [
      "core/architecture-decision-records",
      "core/brainstorming",
      "core/clarify-requirements",
      "core/code-maturity-assessor",
      "core/code-review-pro",
      "core/code-review-process",
      "core/context-engineering",
      "core/continuous-learning",
      "core/dependency-upgrade",
      "core/design-patterns",
      "core/duplicate-detection",
      "core/e2e-testing",
      "core/error-memory",
      "core/git-cleanup",
      "core/legacy-modernizer",
      "core/monorepo-management",
      "core/parallel-debugging",
      "core/plan-fleet",
      "core/property-based-testing",
      "core/strategic-compact",
      "core/systematic-debugging",
      "core/test-driven-development",
      "core/test-writing",
      "core/type-driven-design",
      "core/verified-implementer"
    ],
    "agents": [
      "architecture/architect.md",
      "architecture/architecture-reviewer.md",
      "architecture/backend-architect.md",
      "architecture/c4-architect.md",
      "architecture/design-system-architect.md",
      "architecture/event-sourcing-architect.md",
      "architecture/graphql-architect.md",
      "architecture/kubernetes-architect.md",
      "architecture/monorepo-architect.md",
      "architecture/software-architect.md",
      "architecture/structure-architect.md",
      "code-quality/code-explorer.md",
      "code-quality/code-fixer.md",
      "code-quality/code-reviewer.md",
      "code-quality/code-simplifier.md",
      "code-quality/refactor-cleaner.md",
      "code-quality/refactoring-specialist.md",
      "code-quality/self-review.md",
      "debugging/bug-hunter.md",
      "debugging/bug-reproduction-validator.md",
      "debugging/build-error-resolver.md",
      "debugging/console-monitor.md",
      "debugging/debugger.md",
      "debugging/error-detective.md",
      "debugging/silent-failure-hunter.md",
      "documentation/doc-updater.md",
      "planning/planner.md",
      "teams/implementer.md",
      "testing/browser-qa-agent.md",
      "testing/e2e-runner.md",
      "testing/e2e-test-agent.md",
      "testing/fullstack-qa-orchestrator.md",
      "testing/pr-test-analyzer.md",
      "testing/qa-engineer.md",
      "testing/tdd-guide.md",
      "testing/test-automator.md",
      "testing/test-coverage-reviewer.md",
      "testing/test-runner.md"
    ],
    "commands": [
      "architecture/c4-architecture.md",
      "architecture/correction-record.md",
      "architecture/cross-platform.md",
      "architecture/design-review.md",
      "architecture/design-system-setup.md",
      "architecture/design.md",
      "architecture/evolve.md",
      "architecture/learn-eval.md",
      "architecture/learn.md",
      "architecture/legacy-modernize.md",
      "database/brainstorm.md",
      "debugging/cleanup.md",
      "debugging/compound.md",
      "debugging/log.md",
      "debugging/stats.md",
      "development/bugfix.md",
      "development/build-fix.md",
      "development/build.md",
      "development/code-explain.md",
      "development/code-migrate.md",
      "development/commit-push-pr.md",
      "development/commit.md",
      "development/feature-dev.md",
      "development/feature-prd.md",
      "development/implement.md",
      "development/multi-model-dev.md",
      "development/new-sdk-app.md",
      "development/new-track.md",
      "development/optimize.md",
      "development/performance-optimization.md",
      "development/refactor-clean.md",
      "development/refine.md",
      "development/smart-debug.md",
      "development/smart-fix.md",
      "development/tdd.md",
      "development/tech-debt.md",
      "development/work.md",
      "session/check-todos.md",
      "session/checkpoint.md",
      "testing/e2e.md",
      "testing/index.md",
      "testing/issue.md",
      "testing/test-browser.md",
      "testing/test-coverage.md",
      "testing/test-generate.md",
      "testing/test-xcode.md"
    ],
    "hooks": [
      "session-start.js",
      "session-end.js",
      "pre-compact.js",
      "post-edit-format.js"
    ],
    "templates": [
      "claude/CLAUDE-MD-TEMPLATE.md",
      "docs/SKILL-MD-TEMPLATE.md",
      "session/SESSION-HANDOFF-TEMPLATE.md"
    ]
  }
}
