{
  "$schema": "./schema.json",
  "name": "go",
  "version": "1.0.0",
  "description": "Go development: concurrency patterns, testing, and idiomatic Go practices",
  "author": "William Newton",
  "license": "MIT",
  "tags": [
    "go",
    "golang",
    "concurrency",
    "backend"
  ],
  "dependencies": [
    "core"
  ],
  "resources": {
    "skills": [
      "go/golang-patterns",
      "go/golang-testing"
    ],
    "agents": [
      "debugging/go-build-resolver.md"
    ],
    "commands": [
      "languages/go.md"
    ]
  }
}
