{
  "$schema": "./schema.json",
  "name": "security",
  "version": "1.0.0",
  "description": "Security analysis: vulnerability scanning, threat modeling, fuzzing, auditing, and secure coding practices",
  "author": "William Newton",
  "license": "MIT",
  "tags": [
    "security",
    "audit",
    "vulnerability",
    "fuzzing",
    "threat-modeling"
  ],
  "dependencies": [
    "core"
  ],
  "resources": {
    "skills": [
      "security/address-sanitizer",
      "security/agentic-actions-auditor",
      "security/api-footgun-detector",
      "security/auth-implementation-patterns",
      "security/cargo-fuzz",
      "security/codeql",
      "security/constant-time-crypto",
      "security/fuzz-harness-writing",
      "security/insecure-defaults",
      "security/memory-safety-patterns",
      "security/ossfuzz",
      "security/pci-compliance",
      "security/pii-redactor",
      "security/sast-configuration",
      "security/seatbelt-sandboxer",
      "security/secrets-management",
      "security/security-audit-methodology",
      "security/security-review",
      "security/semgrep",
      "security/stride-analysis-patterns",
      "security/supply-chain-risk-auditor",
      "security/threat-mitigation-mapping",
      "security/wycheproof",
      "security/yara-rule-authoring"
    ],
    "agents": [
      "code-quality/code-auditor.md",
      "code-quality/dep-auditor.md",
      "code-quality/perf-auditor.md",
      "data/db-auditor.md",
      "debugging/bug-auditor.md",
      "devops/infra-auditor.md",
      "documentation/doc-auditor.md",
      "frontend/ui-auditor.md",
      "security/backend-security-coder.md",
      "security/contracts-reviewer.md",
      "security/exploitability-verifier.md",
      "security/frontend-security-coder.md",
      "security/incident-responder.md",
      "security/malware-analyst.md",
      "security/mobile-security-coder.md",
      "security/security-expert.md",
      "security/semgrep-scanner.md",
      "security/threat-modeling-expert.md"
    ],
    "commands": [
      "audit/audit-context.md",
      "audit/audit.md",
      "audit/compliance-check.md",
      "audit/deps-audit.md",
      "audit/deps-upgrade.md",
      "audit/review.md",
      "audit/spec-compliance.md",
      "audit/spec-panel.md",
      "security/incident-response.md",
      "security/scan-apk.md",
      "security/security-dependencies.md",
      "security/security-hardening.md",
      "security/security-sast.md",
      "security/semgrep-rule.md",
      "security/ssl.md",
      "security/unsafe-check.md",
      "security/unsafe-review.md",
      "security/xss-scan.md"
    ]
  }
}
